{
  "$schema": "https://json-schema.org/draft/2020-12/schema",
  "$id": "https://kids-learning.local/schemas/lesson.schema.json",
  "title": "Lesson",
  "description": "A complete interactive lesson. Generated by the backend, rendered by the Android app. Schema version 1.0 supports the six V1 activity types plus explanation cards.",
  "type": "object",
  "additionalProperties": false,
  "required": [
    "schema_version",
    "lesson_id",
    "title",
    "subject",
    "language",
    "age",
    "difficulty",
    "learning_objectives",
    "concepts",
    "sections",
    "completion_message"
  ],
  "properties": {
    "schema_version": {
      "const": "1.0",
      "description": "Schema version this lesson conforms to. Stored with every lesson so future app versions can migrate or refuse gracefully."
    },
    "lesson_id": { "$ref": "#/$defs/id" },
    "title": { "type": "string", "minLength": 1, "maxLength": 120 },
    "subject": { "type": "string", "minLength": 1, "maxLength": 60 },
    "language": {
      "type": "string",
      "pattern": "^[a-z]{2}(-[A-Z]{2})?$",
      "description": "BCP-47 style language tag, e.g. 'en' or 'en-GB'."
    },
    "age": { "type": "integer", "minimum": 3, "maximum": 18 },
    "difficulty": { "enum": ["beginner", "intermediate", "advanced"] },
    "estimated_duration_minutes": { "type": "integer", "minimum": 1, "maximum": 120 },
    "learning_objectives": {
      "type": "array",
      "minItems": 1,
      "maxItems": 8,
      "items": { "type": "string", "minLength": 1, "maxLength": 200 }
    },
    "concepts": {
      "type": "array",
      "minItems": 1,
      "maxItems": 12,
      "description": "Concepts taught in this lesson. Activities reference these by concept_id; mastery is tracked per concept.",
      "items": {
        "type": "object",
        "additionalProperties": false,
        "required": ["concept_id", "name"],
        "properties": {
          "concept_id": { "$ref": "#/$defs/id" },
          "name": { "type": "string", "minLength": 1, "maxLength": 80 }
        }
      }
    },
    "source_references": {
      "type": "array",
      "description": "Uploaded sources this lesson was generated from. Empty for lessons generated purely from a typed topic.",
      "items": {
        "type": "object",
        "additionalProperties": false,
        "required": ["source_id"],
        "properties": {
          "source_id": { "$ref": "#/$defs/id" },
          "title": { "type": "string", "maxLength": 200 },
          "pages": {
            "type": "array",
            "items": { "type": "integer", "minimum": 1 }
          }
        }
      }
    },
    "sections": {
      "type": "array",
      "minItems": 1,
      "maxItems": 40,
      "items": { "$ref": "#/$defs/section" }
    },
    "completion_message": { "type": "string", "minLength": 1, "maxLength": 300 }
  },
  "$defs": {
    "id": {
      "type": "string",
      "pattern": "^[a-z0-9][a-z0-9_-]{0,63}$",
      "description": "Lowercase identifier: letters, digits, underscore, hyphen."
    },
    "grounding": {
      "type": "object",
      "additionalProperties": false,
      "required": ["basis"],
      "description": "Where this content came from, so the parent can verify it against the source.",
      "properties": {
        "basis": {
          "enum": ["source_explicit", "general_knowledge", "interpretation"],
          "description": "source_explicit: stated in the uploaded material. general_knowledge: standard educational fact not in the source. interpretation: reasoned from the source but not stated."
        },
        "source_id": { "$ref": "#/$defs/id" },
        "pages": {
          "type": "array",
          "items": { "type": "integer", "minimum": 1 }
        }
      }
    },
    "sectionBase": {
      "type": "object",
      "required": ["id", "type"],
      "properties": {
        "id": { "$ref": "#/$defs/id" },
        "type": { "type": "string" },
        "concept_id": { "$ref": "#/$defs/id" },
        "difficulty_level": {
          "type": "integer",
          "minimum": 1,
          "maximum": 5,
          "description": "Position on the lesson's difficulty progression. Extensions continue from the highest level the child has mastered."
        },
        "grounding": { "$ref": "#/$defs/grounding" }
      }
    },
    "activityFeedback": {
      "type": "object",
      "required": ["hint", "correct_feedback", "incorrect_feedback"],
      "properties": {
        "hint": { "type": "string", "minLength": 1, "maxLength": 300 },
        "correct_feedback": { "type": "string", "minLength": 1, "maxLength": 300 },
        "incorrect_feedback": {
          "type": "string",
          "minLength": 1,
          "maxLength": 300,
          "description": "Must teach toward the right idea, not just say 'try again'."
        }
      }
    },
    "option": {
      "type": "object",
      "additionalProperties": false,
      "required": ["id", "text"],
      "properties": {
        "id": { "$ref": "#/$defs/id" },
        "text": { "type": "string", "minLength": 1, "maxLength": 120 }
      }
    },
    "section": {
      "oneOf": [
        { "$ref": "#/$defs/explanation" },
        { "$ref": "#/$defs/multipleChoice" },
        { "$ref": "#/$defs/trueFalse" },
        { "$ref": "#/$defs/fillInTheBlank" },
        { "$ref": "#/$defs/matchPairs" },
        { "$ref": "#/$defs/dragIntoOrder" }
      ]
    },
    "explanation": {
      "allOf": [{ "$ref": "#/$defs/sectionBase" }],
      "type": "object",
      "unevaluatedProperties": false,
      "required": ["title", "content"],
      "properties": {
        "type": { "const": "explanation" },
        "title": { "type": "string", "minLength": 1, "maxLength": 100 },
        "content": { "type": "string", "minLength": 1, "maxLength": 1200 },
        "image_description": {
          "type": "string",
          "maxLength": 300,
          "description": "Optional description of an illustration for this card. V1 renders it as a caption placeholder; later versions may generate or fetch an image."
        }
      }
    },
    "multipleChoice": {
      "allOf": [
        { "$ref": "#/$defs/sectionBase" },
        { "$ref": "#/$defs/activityFeedback" }
      ],
      "type": "object",
      "unevaluatedProperties": false,
      "required": ["question", "options", "correct_answer_ids", "selection_mode"],
      "properties": {
        "type": { "const": "multiple_choice" },
        "question": { "type": "string", "minLength": 1, "maxLength": 300 },
        "selection_mode": {
          "enum": ["single", "multiple"],
          "description": "single renders as tap-one; multiple renders as select-all-that-apply."
        },
        "options": {
          "type": "array",
          "minItems": 2,
          "maxItems": 6,
          "items": { "$ref": "#/$defs/option" }
        },
        "correct_answer_ids": {
          "type": "array",
          "minItems": 1,
          "items": { "$ref": "#/$defs/id" }
        }
      }
    },
    "trueFalse": {
      "allOf": [
        { "$ref": "#/$defs/sectionBase" },
        { "$ref": "#/$defs/activityFeedback" }
      ],
      "type": "object",
      "unevaluatedProperties": false,
      "required": ["statement", "correct_answer"],
      "properties": {
        "type": { "const": "true_false" },
        "statement": { "type": "string", "minLength": 1, "maxLength": 300 },
        "correct_answer": { "type": "boolean" }
      }
    },
    "fillInTheBlank": {
      "allOf": [
        { "$ref": "#/$defs/sectionBase" },
        { "$ref": "#/$defs/activityFeedback" }
      ],
      "type": "object",
      "unevaluatedProperties": false,
      "required": ["template", "blanks"],
      "properties": {
        "type": { "const": "fill_in_the_blank" },
        "template": {
          "type": "string",
          "minLength": 1,
          "maxLength": 400,
          "description": "Sentence containing one {{blank_id}} marker per blank, e.g. 'Water turns into {{b1}} when heated.'"
        },
        "blanks": {
          "type": "array",
          "minItems": 1,
          "maxItems": 3,
          "items": {
            "type": "object",
            "additionalProperties": false,
            "required": ["id", "accepted_answers"],
            "properties": {
              "id": { "$ref": "#/$defs/id" },
              "accepted_answers": {
                "type": "array",
                "minItems": 1,
                "items": { "type": "string", "minLength": 1, "maxLength": 60 }
              },
              "case_sensitive": { "type": "boolean", "default": false }
            }
          }
        },
        "word_bank": {
          "type": "array",
          "minItems": 2,
          "maxItems": 8,
          "items": { "type": "string", "minLength": 1, "maxLength": 60 },
          "description": "Optional tap-to-fill word choices (correct answers plus distractors). Required for ages 6 and under, where typing is not appropriate."
        }
      }
    },
    "matchPairs": {
      "allOf": [
        { "$ref": "#/$defs/sectionBase" },
        { "$ref": "#/$defs/activityFeedback" }
      ],
      "type": "object",
      "unevaluatedProperties": false,
      "required": ["instruction", "pairs"],
      "properties": {
        "type": { "const": "match_pairs" },
        "instruction": { "type": "string", "minLength": 1, "maxLength": 200 },
        "pairs": {
          "type": "array",
          "minItems": 2,
          "maxItems": 6,
          "items": {
            "type": "object",
            "additionalProperties": false,
            "required": ["left", "right"],
            "properties": {
              "left": { "$ref": "#/$defs/option" },
              "right": { "$ref": "#/$defs/option" }
            }
          }
        }
      }
    },
    "dragIntoOrder": {
      "allOf": [
        { "$ref": "#/$defs/sectionBase" },
        { "$ref": "#/$defs/activityFeedback" }
      ],
      "type": "object",
      "unevaluatedProperties": false,
      "required": ["instruction", "items", "correct_order"],
      "properties": {
        "type": { "const": "drag_into_order" },
        "instruction": { "type": "string", "minLength": 1, "maxLength": 200 },
        "items": {
          "type": "array",
          "minItems": 2,
          "maxItems": 6,
          "items": { "$ref": "#/$defs/option" }
        },
        "correct_order": {
          "type": "array",
          "minItems": 2,
          "items": { "$ref": "#/$defs/id" },
          "description": "Item ids in the correct sequence. Must be an exact permutation of items."
        }
      }
    }
  }
}
